{
	"$schema": "https://json-schema.org/draft/2020-12/schema",
	"$id": "https://ue-shed.dev/contracts/cameras/provisioning/v1/provision-request.schema.json",
	"type": "object",
	"properties": {
		"cameras": {
			"type": "array",
			"items": {
				"anyOf": [
					{
						"type": "object",
						"properties": {
							"visibility": {
								"type": "object",
								"properties": {
									"hide": {
										"type": "array",
										"items": {
											"type": "object",
											"properties": {
												"locator": {
													"anyOf": [
														{
															"type": "object",
															"properties": {
																"kind": {
																	"type": "string",
																	"enum": ["actor_path"]
																},
																"actorPath": {
																	"type": "string",
																	"allOf": [
																		{
																			"pattern": "^\\/Game\\/"
																		},
																		{
																			"maxLength": 4096
																		}
																	]
																}
															},
															"required": ["kind", "actorPath"],
															"additionalProperties": false
														},
														{
															"type": "object",
															"properties": {
																"kind": {
																	"type": "string",
																	"enum": ["actor_guid"]
																},
																"actorGuid": {
																	"type": "string",
																	"allOf": [
																		{
																			"pattern": "^(?!00000000-00000000-00000000-00000000$)[0-9a-fA-F]{8}(?:-[0-9a-fA-F]{8}){3}$"
																		}
																	]
																},
																"lastKnownActorPath": {
																	"type": "string",
																	"allOf": [
																		{
																			"maxLength": 4096
																		}
																	]
																}
															},
															"required": [
																"kind",
																"actorGuid",
																"lastKnownActorPath"
															],
															"additionalProperties": false
														}
													]
												},
												"label": {
													"type": "string",
													"allOf": [
														{
															"maxLength": 256
														}
													]
												}
											},
											"required": ["locator", "label"],
											"additionalProperties": false
										},
										"allOf": [
											{
												"maxItems": 256
											}
										]
									},
									"protect": {
										"type": "array",
										"items": {
											"type": "object",
											"properties": {
												"locator": {
													"anyOf": [
														{
															"type": "object",
															"properties": {
																"kind": {
																	"type": "string",
																	"enum": ["actor_path"]
																},
																"actorPath": {
																	"type": "string",
																	"allOf": [
																		{
																			"pattern": "^\\/Game\\/"
																		},
																		{
																			"maxLength": 4096
																		}
																	]
																}
															},
															"required": ["kind", "actorPath"],
															"additionalProperties": false
														},
														{
															"type": "object",
															"properties": {
																"kind": {
																	"type": "string",
																	"enum": ["actor_guid"]
																},
																"actorGuid": {
																	"type": "string",
																	"allOf": [
																		{
																			"pattern": "^(?!00000000-00000000-00000000-00000000$)[0-9a-fA-F]{8}(?:-[0-9a-fA-F]{8}){3}$"
																		}
																	]
																},
																"lastKnownActorPath": {
																	"type": "string",
																	"allOf": [
																		{
																			"maxLength": 4096
																		}
																	]
																}
															},
															"required": [
																"kind",
																"actorGuid",
																"lastKnownActorPath"
															],
															"additionalProperties": false
														}
													]
												},
												"label": {
													"type": "string",
													"allOf": [
														{
															"maxLength": 256
														}
													]
												}
											},
											"required": ["locator", "label"],
											"additionalProperties": false
										},
										"allOf": [
											{
												"maxItems": 256
											}
										]
									}
								},
								"required": ["hide", "protect"],
								"additionalProperties": false
							},
							"correlation": {
								"anyOf": [
									{
										"type": "object",
										"properties": {
											"candidateId": {
												"type": "string",
												"allOf": [
													{
														"minLength": 1
													},
													{
														"maxLength": 384
													},
													{
														"pattern": "^[A-Za-z0-9][A-Za-z0-9._/-]*$"
													}
												]
											},
											"type": {
												"type": "string",
												"enum": ["framing_candidate"]
											}
										},
										"required": ["candidateId", "type"],
										"additionalProperties": false
									},
									{
										"type": "object",
										"properties": {
											"reviewViewId": {
												"type": "string",
												"allOf": [
													{
														"minLength": 1
													},
													{
														"pattern": "^[A-Za-z0-9][A-Za-z0-9._-]{0,127}$"
													}
												]
											},
											"type": {
												"type": "string",
												"enum": ["review_view"]
											}
										},
										"required": ["reviewViewId", "type"],
										"additionalProperties": false
									},
									{
										"type": "object",
										"properties": {
											"mapCapturePlanId": {
												"type": "string",
												"allOf": [
													{
														"pattern": "^[A-Za-z0-9][A-Za-z0-9._-]{0,127}$"
													}
												]
											},
											"type": {
												"type": "string",
												"enum": ["map_capture_plan"]
											}
										},
										"required": ["mapCapturePlanId", "type"],
										"additionalProperties": false
									}
								]
							},
							"height": {
								"type": "integer",
								"allOf": [
									{
										"minimum": 64,
										"maximum": 1440
									}
								]
							},
							"location": {
								"type": "object",
								"properties": {
									"x": {
										"type": "number"
									},
									"y": {
										"type": "number"
									},
									"z": {
										"type": "number"
									}
								},
								"required": ["x", "y", "z"],
								"additionalProperties": false
							},
							"rotation": {
								"type": "object",
								"properties": {
									"pitch": {
										"type": "number"
									},
									"roll": {
										"type": "number"
									},
									"yaw": {
										"type": "number"
									}
								},
								"required": ["pitch", "roll", "yaw"],
								"additionalProperties": false
							},
							"width": {
								"type": "integer",
								"allOf": [
									{
										"minimum": 64,
										"maximum": 2560
									}
								]
							},
							"projection": {
								"type": "object",
								"properties": {
									"fieldOfViewDegrees": {
										"type": "number",
										"allOf": [
											{
												"minimum": 5,
												"maximum": 170
											}
										]
									},
									"type": {
										"type": "string",
										"enum": ["perspective"]
									}
								},
								"required": ["fieldOfViewDegrees", "type"],
								"additionalProperties": false
							}
						},
						"required": [
							"correlation",
							"height",
							"location",
							"rotation",
							"width",
							"projection"
						],
						"additionalProperties": false
					},
					{
						"type": "object",
						"properties": {
							"visibility": {
								"type": "object",
								"properties": {
									"hide": {
										"type": "array",
										"items": {
											"type": "object",
											"properties": {
												"locator": {
													"anyOf": [
														{
															"type": "object",
															"properties": {
																"kind": {
																	"type": "string",
																	"enum": ["actor_path"]
																},
																"actorPath": {
																	"type": "string",
																	"allOf": [
																		{
																			"pattern": "^\\/Game\\/"
																		},
																		{
																			"maxLength": 4096
																		}
																	]
																}
															},
															"required": ["kind", "actorPath"],
															"additionalProperties": false
														},
														{
															"type": "object",
															"properties": {
																"kind": {
																	"type": "string",
																	"enum": ["actor_guid"]
																},
																"actorGuid": {
																	"type": "string",
																	"allOf": [
																		{
																			"pattern": "^(?!00000000-00000000-00000000-00000000$)[0-9a-fA-F]{8}(?:-[0-9a-fA-F]{8}){3}$"
																		}
																	]
																},
																"lastKnownActorPath": {
																	"type": "string",
																	"allOf": [
																		{
																			"maxLength": 4096
																		}
																	]
																}
															},
															"required": [
																"kind",
																"actorGuid",
																"lastKnownActorPath"
															],
															"additionalProperties": false
														}
													]
												},
												"label": {
													"type": "string",
													"allOf": [
														{
															"maxLength": 256
														}
													]
												}
											},
											"required": ["locator", "label"],
											"additionalProperties": false
										},
										"allOf": [
											{
												"maxItems": 256
											}
										]
									},
									"protect": {
										"type": "array",
										"items": {
											"type": "object",
											"properties": {
												"locator": {
													"anyOf": [
														{
															"type": "object",
															"properties": {
																"kind": {
																	"type": "string",
																	"enum": ["actor_path"]
																},
																"actorPath": {
																	"type": "string",
																	"allOf": [
																		{
																			"pattern": "^\\/Game\\/"
																		},
																		{
																			"maxLength": 4096
																		}
																	]
																}
															},
															"required": ["kind", "actorPath"],
															"additionalProperties": false
														},
														{
															"type": "object",
															"properties": {
																"kind": {
																	"type": "string",
																	"enum": ["actor_guid"]
																},
																"actorGuid": {
																	"type": "string",
																	"allOf": [
																		{
																			"pattern": "^(?!00000000-00000000-00000000-00000000$)[0-9a-fA-F]{8}(?:-[0-9a-fA-F]{8}){3}$"
																		}
																	]
																},
																"lastKnownActorPath": {
																	"type": "string",
																	"allOf": [
																		{
																			"maxLength": 4096
																		}
																	]
																}
															},
															"required": [
																"kind",
																"actorGuid",
																"lastKnownActorPath"
															],
															"additionalProperties": false
														}
													]
												},
												"label": {
													"type": "string",
													"allOf": [
														{
															"maxLength": 256
														}
													]
												}
											},
											"required": ["locator", "label"],
											"additionalProperties": false
										},
										"allOf": [
											{
												"maxItems": 256
											}
										]
									}
								},
								"required": ["hide", "protect"],
								"additionalProperties": false
							},
							"correlation": {
								"anyOf": [
									{
										"type": "object",
										"properties": {
											"candidateId": {
												"type": "string",
												"allOf": [
													{
														"minLength": 1
													},
													{
														"maxLength": 384
													},
													{
														"pattern": "^[A-Za-z0-9][A-Za-z0-9._/-]*$"
													}
												]
											},
											"type": {
												"type": "string",
												"enum": ["framing_candidate"]
											}
										},
										"required": ["candidateId", "type"],
										"additionalProperties": false
									},
									{
										"type": "object",
										"properties": {
											"reviewViewId": {
												"type": "string",
												"allOf": [
													{
														"minLength": 1
													},
													{
														"pattern": "^[A-Za-z0-9][A-Za-z0-9._-]{0,127}$"
													}
												]
											},
											"type": {
												"type": "string",
												"enum": ["review_view"]
											}
										},
										"required": ["reviewViewId", "type"],
										"additionalProperties": false
									},
									{
										"type": "object",
										"properties": {
											"mapCapturePlanId": {
												"type": "string",
												"allOf": [
													{
														"pattern": "^[A-Za-z0-9][A-Za-z0-9._-]{0,127}$"
													}
												]
											},
											"type": {
												"type": "string",
												"enum": ["map_capture_plan"]
											}
										},
										"required": ["mapCapturePlanId", "type"],
										"additionalProperties": false
									}
								]
							},
							"height": {
								"type": "integer",
								"allOf": [
									{
										"minimum": 64,
										"maximum": 1440
									}
								]
							},
							"location": {
								"type": "object",
								"properties": {
									"x": {
										"type": "number"
									},
									"y": {
										"type": "number"
									},
									"z": {
										"type": "number"
									}
								},
								"required": ["x", "y", "z"],
								"additionalProperties": false
							},
							"rotation": {
								"type": "object",
								"properties": {
									"pitch": {
										"type": "number"
									},
									"roll": {
										"type": "number"
									},
									"yaw": {
										"type": "number"
									}
								},
								"required": ["pitch", "roll", "yaw"],
								"additionalProperties": false
							},
							"width": {
								"type": "integer",
								"allOf": [
									{
										"minimum": 64,
										"maximum": 2560
									}
								]
							},
							"projection": {
								"type": "object",
								"properties": {
									"orthoWidth": {
										"type": "number",
										"allOf": [
											{
												"exclusiveMinimum": 0
											}
										]
									},
									"type": {
										"type": "string",
										"enum": ["orthographic"]
									}
								},
								"required": ["orthoWidth", "type"],
								"additionalProperties": false
							}
						},
						"required": [
							"correlation",
							"height",
							"location",
							"rotation",
							"width",
							"projection"
						],
						"additionalProperties": false
					}
				]
			},
			"allOf": [
				{
					"minItems": 1
				},
				{
					"maxItems": 32
				}
			]
		},
		"expectedMapPath": {
			"type": "string",
			"allOf": [
				{
					"minLength": 1
				},
				{
					"maxLength": 1024
				},
				{
					"pattern": "^\\/[A-Za-z0-9_./-]+$"
				}
			]
		},
		"previewFps": {
			"type": "integer",
			"allOf": [
				{
					"minimum": 1,
					"maximum": 10
				}
			]
		},
		"editorPreviews": {
			"type": "boolean"
		},
		"schemaVersion": {
			"type": "number",
			"enum": [3, 4, 5]
		}
	},
	"required": ["cameras", "expectedMapPath", "previewFps", "schemaVersion"],
	"additionalProperties": false,
	"$defs": {}
}
